web-scraper-order,web-scraper-start-url,author,title,date,content,rating,label
1580573669-932,https://www.amazon.in/Redmi-Note-Pro-Storage-Processor/product-reviews/B07X2KLKRZ/ref=cm_cr_dp_d_show_all_btm?ie=UTF8&reviewerType=all_reviews,Amazon Customer,Thanks to Delivery at my wishes time,Reviewed in India on 30 December 2019,"Thanks for delivery on 30th Dec because ordered time estimate time was 6th Jan 20 then 30th Dec My lovingly Meghan(Wife) B'day. Also I requested to Amazon. Amazon has completely fulfill my wishes. So again thanks. Also I not cancelled order if my order received on 6th Jan. But my wishes has B'day gift is on occasion. After it's not it's charmed.
Thanks for your kind consideration.
Thanking you
Sandip Raval
99250 03007",5.0 out of 5 stars, spam
1580573644-848,https://www.amazon.in/Redmi-Note-Pro-Storage-Processor/product-reviews/B07X2KLKRZ/ref=cm_cr_dp_d_show_all_btm?ie=UTF8&reviewerType=all_reviews,Amazon Customer,Sensor Issue,Reviewed in India on 10 November 2019,"Hi Team,

I am having a trouble time with the phone touch. It's response time is terrible.",1.0 out of 5 stars,quality
1580574377-3407,https://www.amazon.in/Redmi-Note-Pro-Storage-Processor/product-reviews/B07X2KLKRZ/ref=cm_cr_dp_d_show_all_btm?ie=UTF8&reviewerType=all_reviews,Angel Singh,The Beast with Limitations..,Reviewed in India on 25 January 2020,"Redmi's Personal Beast is Overall The Best in Market except #AmoleD Pannels ....
This is not for you if Your an Android enthusiast...",5.0 out of 5 stars,quality
1580573743-1197,https://www.amazon.in/Redmi-Note-Pro-Storage-Processor/product-reviews/B07X2KLKRZ/ref=cm_cr_dp_d_show_all_btm?ie=UTF8&reviewerType=all_reviews,khaja,Camera Error and Heavy weight,Reviewed in India on 17 November 2019,"very bad camera. whenever I start camera it is showing ""camera error. cannot connect to camera"" pops up. we have tried and force stopped the camera app and rebooted. even after having the same error. 0 star for camera  Thinking to return if the problem repeats for 1or 2more days.

weight is also very heavy",1.0 out of 5 stars,quality
1580574487-3799,https://www.amazon.in/Redmi-Note-Pro-Storage-Processor/product-reviews/B07X2KLKRZ/ref=cm_cr_dp_d_show_all_btm?ie=UTF8&reviewerType=all_reviews,SYAM KRISHNAN.P,Decent product,Reviewed in India on 22 November 2019,It's not a magical device.. But it won't make you sad. Camera is average only.. selfie camera is poor.. all other features are fine.,4.0 out of 5 stars,quality
1580574111-2474,https://www.amazon.in/Redmi-Note-Pro-Storage-Processor/product-reviews/B07X2KLKRZ/ref=cm_cr_dp_d_show_all_btm?ie=UTF8&reviewerType=all_reviews,Siddhi Parab,Just Wow!,Reviewed in India on 1 December 2019,"This is the best phone to buy in 15K!
The camera is good, the battery is best, the screen quality is good too. I played a game of COD and my phone went from 98% to 92%
It's that good",5.0 out of 5 stars,quality
1580574090-2402,https://www.amazon.in/Redmi-Note-Pro-Storage-Processor/product-reviews/B07X2KLKRZ/ref=cm_cr_dp_d_show_all_btm?ie=UTF8&reviewerType=all_reviews,AmazonCustomer007,Beast in 16k,Reviewed in India on 16 November 2019,"In all aspect it's pretty good in that budget segment. I don't use it for high performance. But while in video calling , it's rear camera gets heated. But later on it's cool down very fast.",4.0 out of 5 stars,quality
1580573781-1324,https://www.amazon.in/Redmi-Note-Pro-Storage-Processor/product-reviews/B07X2KLKRZ/ref=cm_cr_dp_d_show_all_btm?ie=UTF8&reviewerType=all_reviews,Pradyumna sankpal,Budget Monster !,Reviewed in India on 21 January 2020,"Best for Heavy users, below 15000. it was feel and perform like 20 - 25000 r s phones . Helio G90T runs games and app smoothly ,specially  PUBG.  audio is above average ,Alexa works perfect and the main camera in excellent it captures photos nicely . 18 W fast charger charges full battery {4500} mah  in just 110 min .",5.0 out of 5 stars,quality
1580573500-346,https://www.amazon.in/Redmi-Note-Pro-Storage-Processor/product-reviews/B07X2KLKRZ/ref=cm_cr_dp_d_show_all_btm?ie=UTF8&reviewerType=all_reviews,Md Wahab Ansari,Heating problem,Reviewed in India on 7 November 2019,This is awesome phone but one issue heating problem,1.0 out of 5 stars,quality
1580574524-3924,https://www.amazon.in/Redmi-Note-Pro-Storage-Processor/product-reviews/B07X2KLKRZ/ref=cm_cr_dp_d_show_all_btm?ie=UTF8&reviewerType=all_reviews,fruitesh saxena,Phone is good but one issue in hotspot,Reviewed in India on 30 January 2020,"The Mobile phone performance is awesome but there is an issue in mobile hotspot , in this you can not  manage connected device.",5.0 out of 5 stars,quality
1580573898-1747,https://www.amazon.in/Redmi-Note-Pro-Storage-Processor/product-reviews/B07X2KLKRZ/ref=cm_cr_dp_d_show_all_btm?ie=UTF8&reviewerType=all_reviews,Saurabh Choudhary,Good choice for a Midrange Smartphone,Reviewed in India on 30 December 2019,"Camera is good, processor is fast, video quality is good.. audio not that loud without headphones. What it is on maximum loud should be on somewhat more than half.. battery charging is decently fast but battery life is not that efficient for a 4500 Mph phone.",4.0 out of 5 stars,quality
1580574733-4637,https://www.amazon.in/Redmi-Note-Pro-Storage-Processor/product-reviews/B07X2KLKRZ/ref=cm_cr_dp_d_show_all_btm?ie=UTF8&reviewerType=all_reviews,Atul kumar tiwari,King of budget smartphones,Reviewed in India on 8 November 2019,"Amazing performance build quality excellent
But literally am disappointed because lack of Amoled display",5.0 out of 5 stars,quality
1580574558-4041,https://www.amazon.in/Redmi-Note-Pro-Storage-Processor/product-reviews/B07X2KLKRZ/ref=cm_cr_dp_d_show_all_btm?ie=UTF8&reviewerType=all_reviews,Krishna,Video recording time phone is very heat problem,Reviewed in India on 27 January 2020,Video recording time phone Very heat,4.0 out of 5 stars,quality
1580573810-1429,https://www.amazon.in/Redmi-Note-Pro-Storage-Processor/product-reviews/B07X2KLKRZ/ref=cm_cr_dp_d_show_all_btm?ie=UTF8&reviewerType=all_reviews,ujjwalkumar,Waste of money totally useless,Reviewed in India on 4 December 2019,"Totally different from as specification, heating issue, camera quality, performance is not good totally waste of money",1.0 out of 5 stars,quality
1580574742-4663,https://www.amazon.in/Redmi-Note-Pro-Storage-Processor/product-reviews/B07X2KLKRZ/ref=cm_cr_dp_d_show_all_btm?ie=UTF8&reviewerType=all_reviews,surah Yadav,My new phone this is 6th phone in 2 years,Reviewed in India on 26 January 2020,Nice phone,5.0 out of 5 stars,quality
1580574117-2498,https://www.amazon.in/Redmi-Note-Pro-Storage-Processor/product-reviews/B07X2KLKRZ/ref=cm_cr_dp_d_show_all_btm?ie=UTF8&reviewerType=all_reviews,Sunny,Good.,Reviewed in India on 18 January 2020,"Fingerprint reader is little bit slow, battery life is good, camera quality good.",5.0 out of 5 stars,quality
1580573570-584,https://www.amazon.in/Redmi-Note-Pro-Storage-Processor/product-reviews/B07X2KLKRZ/ref=cm_cr_dp_d_show_all_btm?ie=UTF8&reviewerType=all_reviews,Imran khan,50/50,Reviewed in India on 8 November 2019,"Bluish bleeding is present to the top and bottom sides of the phone.
The one side of the camera display has some bluish appearance. And camera is not much good. Heating issue present in the phone. But the performance is extraordinary. This phone only suitable for hard gamers",3.0 out of 5 stars,quality
1580574511-3890,https://www.amazon.in/Redmi-Note-Pro-Storage-Processor/product-reviews/B07X2KLKRZ/ref=cm_cr_dp_d_show_all_btm?ie=UTF8&reviewerType=all_reviews,DK,Nice mobile,Reviewed in India on 7 November 2019,Good product value for money,4.0 out of 5 stars,quality
1580574137-2565,https://www.amazon.in/Redmi-Note-Pro-Storage-Processor/product-reviews/B07X2KLKRZ/ref=cm_cr_dp_d_show_all_btm?ie=UTF8&reviewerType=all_reviews,usher,No support of apt or LDAC,Reviewed in India on 30 November 2019,"We don't get support of apt or ldac codec support it is very important please do this in miui 11 update
Without that quality of the sound of Bluetooth devices are very bad",1.0 out of 5 stars,quality
1580574311-3180,https://www.amazon.in/Redmi-Note-Pro-Storage-Processor/product-reviews/B07X2KLKRZ/ref=cm_cr_dp_d_show_all_btm?ie=UTF8&reviewerType=all_reviews,Sanal v r,Good,Reviewed in India on 8 November 2019,Good,4.0 out of 5 stars,quality
1580573561-552,https://www.amazon.in/Redmi-Note-Pro-Storage-Processor/product-reviews/B07X2KLKRZ/ref=cm_cr_dp_d_show_all_btm?ie=UTF8&reviewerType=all_reviews,Abhinav Nandi,Currently the best all rounder phone money can buy in this range,Reviewed in India on 25 December 2019,"This phone does feel way more premium than others in this range, looks at par with any 35-45k phone. Comparatively bigger than the Redmi note 8. Feels decently sturdy build wise and the back cover is worth the look. The 64MP camera along with the other ones put up a good show of details, very steady shots(highly commendable). Quite light in weight too and smooth software performance. I recon its the best buy right now, totally worth the price. Be prepared for shockingly quick lightening fast delivery.",5.0 out of 5 stars,quality
1580574043-2246,https://www.amazon.in/Redmi-Note-Pro-Storage-Processor/product-reviews/B07X2KLKRZ/ref=cm_cr_dp_d_show_all_btm?ie=UTF8&reviewerType=all_reviews,Suraj Singh,Amazing phone,Reviewed in India on 6 November 2019,Amazing phone,5.0 out of 5 stars,quality
1580574322-3220,https://www.amazon.in/Redmi-Note-Pro-Storage-Processor/product-reviews/B07X2KLKRZ/ref=cm_cr_dp_d_show_all_btm?ie=UTF8&reviewerType=all_reviews,Pratik,Superb,Reviewed in India on 15 November 2019,Superb,5.0 out of 5 stars,quality
1580573966-1985,https://www.amazon.in/Redmi-Note-Pro-Storage-Processor/product-reviews/B07X2KLKRZ/ref=cm_cr_dp_d_show_all_btm?ie=UTF8&reviewerType=all_reviews,Amit,Budget friendly cell,Reviewed in India on 8 November 2019,"Nice look, Camera is also Awesome, Battery life is average with use of internet. Overall Nice phone with this range.",4.0 out of 5 stars,quality
1580573801-1397,https://www.amazon.in/Redmi-Note-Pro-Storage-Processor/product-reviews/B07X2KLKRZ/ref=cm_cr_dp_d_show_all_btm?ie=UTF8&reviewerType=all_reviews,Amazon Customer,Monster machine,Reviewed in India on 23 November 2019,"I have the 8gb variant and it is awesome in simple words it is a monster machine in every aspect from games to camera and battery live , the only drawback is in display fingerprint scanner",5.0 out of 5 stars,quality
1580574570-4084,https://www.amazon.in/Redmi-Note-Pro-Storage-Processor/product-reviews/B07X2KLKRZ/ref=cm_cr_dp_d_show_all_btm?ie=UTF8&reviewerType=all_reviews,SOHAIl ali,Sohail,Reviewed in India on 2 December 2019,Finger print thick . camera is note good and battery is not good .,3.0 out of 5 stars,quality
1580573840-1538,https://www.amazon.in/Redmi-Note-Pro-Storage-Processor/product-reviews/B07X2KLKRZ/ref=cm_cr_dp_d_show_all_btm?ie=UTF8&reviewerType=all_reviews,P Vijay Kumar,Unbelievably worst mobile from Redmi,Reviewed in India on 29 January 2020,"Worthless mobile, battery gets drained very fast. Even the battery getting drained when it is on stand by mode also. I sincerely suggest not to go with this model. I am using Redmi from the series note 4, but I really unhappy with this model. Very worst battery life and camera quality.",1.0 out of 5 stars,quality
1580574143-2583,https://www.amazon.in/Redmi-Note-Pro-Storage-Processor/product-reviews/B07X2KLKRZ/ref=cm_cr_dp_d_show_all_btm?ie=UTF8&reviewerType=all_reviews,Shawshank,normal is not a problem,Reviewed in India on 30 December 2019,bad for pub g game too much lack processor not powerful,3.0 out of 5 stars,quality
1580574386-3435,https://www.amazon.in/Redmi-Note-Pro-Storage-Processor/product-reviews/B07X2KLKRZ/ref=cm_cr_dp_d_show_all_btm?ie=UTF8&reviewerType=all_reviews,Kuna Magar,Happy with Redmi Note 8 pro,Reviewed in India on 11 January 2020,"Awesome Device, best camera quality, awesome battery life, best performance.......very Good Device........ happy with Redmi Note 8 pro...",5.0 out of 5 stars,quality
1580574281-3069,https://www.amazon.in/Redmi-Note-Pro-Storage-Processor/product-reviews/B07X2KLKRZ/ref=cm_cr_dp_d_show_all_btm?ie=UTF8&reviewerType=all_reviews,zakat u.,One of the best mid rangers,Reviewed in India on 13 January 2020,Phone is brilliant. This is what you can expect from a mi phone. Camera is okay. Overall good phone.,5.0 out of 5 stars,quality
1580574360-3347,https://www.amazon.in/Redmi-Note-Pro-Storage-Processor/product-reviews/B07X2KLKRZ/ref=cm_cr_dp_d_show_all_btm?ie=UTF8&reviewerType=all_reviews,VAIBHAV,"Great looks ,overall nice performance ,decent price",Reviewed in India on 26 November 2019,"Great looks ,overall nice performance ,decent price",4.0 out of 5 stars,quality
1580573389-12,https://www.amazon.in/Redmi-Note-Pro-Storage-Processor/product-reviews/B07X2KLKRZ/ref=cm_cr_dp_d_show_all_btm?ie=UTF8&reviewerType=all_reviews,Abhishek Mehta,The Redmi Note 8 Pro is powered by the MediaTek G90T gaming processor.,Reviewed in India on 9 November 2019,"Redmi Note 8 Pro Specifications:

6.53-inch full HD+ (1080p) display | MediaTek G90T octa-core processor | 6GB or 8GB RAM with 64GB or 128GB storage with expandable storage support up to 512GB |  64MP main camera + 8MP ultra-wide + 2MP macro + 2MP depth camera + 20MP camera | 4500 mAh battery with 18W fast charging | MIUI 10 with Android Pie (9) |

Redmi Note 8 Pro Review: Camera

This is the part which Xiaomi is hyping up, given there’s a 64MP camera out here. The automatic resolution is 16MP. The camera produces bright photos with accurate colour tones, even at night. The selfies are impressive on this phone, and it creates a nice depth in Portrait mode, though it is not all perfect with edges on the hair.

Redmi Note 8 Pro Review: Performance, battery

Games like Asphalt 9, Badland, Nova Legacy all ran without any hitches. I switched Asphalt 9 to high graphics settings and the phone had no problems handling it. The graphics looked smooth without any lag. In regular usage, be it just browsing on social media or using the phone to edit photos to keeping 20 tabs open on Chrome, the experience was smooth.

The only issue I noticed, the phone also got warm around the top when gaming for too long. On the battery front, the Redmi Note 8 Pro has a 4500 mAh battery. The 18W fast charger ensures a full charge in under two hours. With moderate usage, you can go up to two days on this phone, while heavy-duty usage means around one and a half days on the device.

The Redmi Note 8 Pro runs MIUI 10 based on Android Pie. Xiaomi has said it will get MIUI 11 by the end of December. It does come with Alexa pre-loaded, though Google Assistant is there as well.

Redmi Note 8 Pro Review: Design, Display

The Redmi Note 8 Pro has a curved back design, though this is a broad and bulky device compared to the previous variant. One reason is the bigger battery. Redmi Note 8 Pro also has a bigger display at 6.53-inches, with the full HD+ resolution. The curved back means it is easier to hold this with one hand, but the size of the device might not always make it possible.

The positioning of the fingerprint sensor right at the bottom of the camera module is not ideal either, because you will end up touching the lens like I did and covering it with smudges. The macro camera is placed away from the other three sensors to the right with flash on top of it. The idea here is to let people use flash to add more light when using macro shots.

The display on the Redmi Note 8 Pro continues to be one of the best for its price. It does come with Widevine L1 certification you can stream content at HD or full HD on YouTube, Netflix, etc. The viewing angles are good, and this is a sharp display, which works well in most scenarios.",5.0 out of 5 stars,quality
1580573618-752,https://www.amazon.in/Redmi-Note-Pro-Storage-Processor/product-reviews/B07X2KLKRZ/ref=cm_cr_dp_d_show_all_btm?ie=UTF8&reviewerType=all_reviews,dipesh mehta,Great smartphone in affordable price,Reviewed in India on 6 November 2019,"Amazing product
Work great",5.0 out of 5 stars,quality
1580574322-3219,https://www.amazon.in/Redmi-Note-Pro-Storage-Processor/product-reviews/B07X2KLKRZ/ref=cm_cr_dp_d_show_all_btm?ie=UTF8&reviewerType=all_reviews,Rajendra Pawar,Value for money,Reviewed in India on 25 November 2019,"It's Excellent mobile & value for money.
Camera is one of the Best.
Look & feel is very nice.
Overall it's very good mobile.",5.0 out of 5 stars,quality
1580574029-2195,https://www.amazon.in/Redmi-Note-Pro-Storage-Processor/product-reviews/B07X2KLKRZ/ref=cm_cr_dp_d_show_all_btm?ie=UTF8&reviewerType=all_reviews,Amazon Customer,Awesomeeeèe,Reviewed in India on 29 January 2020,Awesome phone camera is very good. Picture quality and battery  life also very good...,5.0 out of 5 stars,quality
1580574264-3010,https://www.amazon.in/Redmi-Note-Pro-Storage-Processor/product-reviews/B07X2KLKRZ/ref=cm_cr_dp_d_show_all_btm?ie=UTF8&reviewerType=all_reviews,T CHAW,Good Product,Reviewed in India on 26 January 2020,"GOOD Product, except extra cover given. It does not give protection to camera. Border of camera is getting rub and colour is getting out.",4.0 out of 5 stars,quality
1580573612-740,https://www.amazon.in/Redmi-Note-Pro-Storage-Processor/product-reviews/B07X2KLKRZ/ref=cm_cr_dp_d_show_all_btm?ie=UTF8&reviewerType=all_reviews,Baha Chaudhary (Shusha),Best in this segment.,Reviewed in India on 16 November 2019,"Cons - Fast charging - full charge takes slightly more than 2 hrs. 0 to 80% in 1hr 30min.
  - Battery Life - Not bad but still Mediate is the reason.  4500mah works me easily for a day and 9 - 11 hrs screen on time.
Pros - Lots
Advise - Those who are facing punchy colour and vibrant colour in screen. Change display colour setting to standard.
Final - Pros - Many
  Cons - almost negligible.
Go for it.",5.0 out of 5 stars,quality
1580573943-1903,https://www.amazon.in/Redmi-Note-Pro-Storage-Processor/product-reviews/B07X2KLKRZ/ref=cm_cr_dp_d_show_all_btm?ie=UTF8&reviewerType=all_reviews,ANKIT3312,Wold no1 mobile,Reviewed in India on 15 November 2019,Awesome Mobile and super camera,5.0 out of 5 stars,quality
1580574046-2259,https://www.amazon.in/Redmi-Note-Pro-Storage-Processor/product-reviews/B07X2KLKRZ/ref=cm_cr_dp_d_show_all_btm?ie=UTF8&reviewerType=all_reviews,Gautama,Pathetic phone,Reviewed in India on 24 November 2019,Worst phone ever ...utter garbage,1.0 out of 5 stars,quality
1580574202-2787,https://www.amazon.in/Redmi-Note-Pro-Storage-Processor/product-reviews/B07X2KLKRZ/ref=cm_cr_dp_d_show_all_btm?ie=UTF8&reviewerType=all_reviews,Biswambar Kayak,"Amazing price, Nice product",Reviewed in India on 20 December 2019,So awesome product. Nice mobile very fast work this mobile. And thanks for MI Redmi.,5.0 out of 5 stars,quality
1580574573-4092,https://www.amazon.in/Redmi-Note-Pro-Storage-Processor/product-reviews/B07X2KLKRZ/ref=cm_cr_dp_d_show_all_btm?ie=UTF8&reviewerType=all_reviews,Kham run,At presto best in Market,Reviewed in India on 21 November 2019,Best phone at this time in this price range,5.0 out of 5 stars,quality
1580573402-47,https://www.amazon.in/Redmi-Note-Pro-Storage-Processor/product-reviews/B07X2KLKRZ/ref=cm_cr_dp_d_show_all_btm?ie=UTF8&reviewerType=all_reviews,Abhijeet Pete war,Sensor problem in this phone .... Don't buy,Reviewed in India on 16 November 2019,Guys don't buy this phone...it's has sensor problems...when u received call it's automatically locked and can't open till call is not cut ....I want to give 0 star for it ....,1.0 out of 5 stars,quality
1580574604-4205,https://www.amazon.in/Redmi-Note-Pro-Storage-Processor/product-reviews/B07X2KLKRZ/ref=cm_cr_dp_d_show_all_btm?ie=UTF8&reviewerType=all_reviews,Arum,Review,Reviewed in India on 4 January 2020,Good phone in this range,4.0 out of 5 stars,quality
1580573926-1842,https://www.amazon.in/Redmi-Note-Pro-Storage-Processor/product-reviews/B07X2KLKRZ/ref=cm_cr_dp_d_show_all_btm?ie=UTF8&reviewerType=all_reviews,Ranjittimung,sect front camera is 32mp,Reviewed in India on 10 November 2019,Like it but but speedy drain,3.0 out of 5 stars,quality
1580574275-3042,https://www.amazon.in/Redmi-Note-Pro-Storage-Processor/product-reviews/B07X2KLKRZ/ref=cm_cr_dp_d_show_all_btm?ie=UTF8&reviewerType=all_reviews,Amazon customer,awesome,Reviewed in India on 25 January 2020,value for money,5.0 out of 5 stars,quality
1580574472-3743,https://www.amazon.in/Redmi-Note-Pro-Storage-Processor/product-reviews/B07X2KLKRZ/ref=cm_cr_dp_d_show_all_btm?ie=UTF8&reviewerType=all_reviews,Sunil halide,Worth for money,Reviewed in India on 20 January 2020,I like the phone very much,5.0 out of 5 stars,quality
1580573879-1677,https://www.amazon.in/Redmi-Note-Pro-Storage-Processor/product-reviews/B07X2KLKRZ/ref=cm_cr_dp_d_show_all_btm?ie=UTF8&reviewerType=all_reviews,Kiran Shukla,Awesome,Reviewed in India on 2 January 2020,Wonderful device build quality was awesome without wasting your time in realme or opportunity vivo just go for it mi also gives a best costumer care service all across india??????????????????????????????????????????????????,5.0 out of 5 stars,quality
1580573840-1532,https://www.amazon.in/Redmi-Note-Pro-Storage-Processor/product-reviews/B07X2KLKRZ/ref=cm_cr_dp_d_show_all_btm?ie=UTF8&reviewerType=all_reviews,kelly,True 64mp beast,Reviewed in India on 19 January 2020,"This phone is beast in performance and battery backup is also good and on playing pubg with 100 percent charge can last more than 3 hrs
In daylight camera is awesome and with 64mp is ultimate
The mobile looks very premium and glossy finish at the back is also awesome",5.0 out of 5 stars,quality
1580573975-2019,https://www.amazon.in/Redmi-Note-Pro-Storage-Processor/product-reviews/B07X2KLKRZ/ref=cm_cr_dp_d_show_all_btm?ie=UTF8&reviewerType=all_reviews,Sheeba Umam,Looks fantastic,Reviewed in India on 12 November 2019,Phone is looking so good in white colour but 18w charger is working slow to charge the phone otherwise phone is good.,5.0 out of 5 stars,quality
1580574763-4738,https://www.amazon.in/Redmi-Note-Pro-Storage-Processor/product-reviews/B07X2KLKRZ/ref=cm_cr_dp_d_show_all_btm?ie=UTF8&reviewerType=all_reviews,Prajin,Good,Reviewed in India on 28 January 2020,Good,5.0 out of 5 stars,quality
1580573460-217,https://www.amazon.in/Redmi-Note-Pro-Storage-Processor/product-reviews/B07X2KLKRZ/ref=cm_cr_dp_d_show_all_btm?ie=UTF8&reviewerType=all_reviews,Shahnawaz khan,Redmi Note 8 pro 2 weak experience than review,Reviewed in India on 7 November 2019,Nice mobile it battery backup very very best. Best mobile under 15k it best mobile for all thing. It speaker is best and sound quality is well.it camera is superb no any comparison. Is speed is very fast and smoothness. Fast charging in the box 18 what fast charger. 1min me 1 percentage charge mobile. Camera quality very very best. This pictures size is 28MB.,5.0 out of 5 stars,quality
1580574526-3933,https://www.amazon.in/Redmi-Note-Pro-Storage-Processor/product-reviews/B07X2KLKRZ/ref=cm_cr_dp_d_show_all_btm?ie=UTF8&reviewerType=all_reviews,PRITHVI,Great Value for money,Reviewed in India on 24 December 2019,Good phone. Extremely responsive touch screen. Great camera even in low light.,4.0 out of 5 stars,quality
1580574804-4878,https://www.amazon.in/Redmi-Note-Pro-Storage-Processor/product-reviews/B07X2KLKRZ/ref=cm_cr_dp_d_show_all_btm?ie=UTF8&reviewerType=all_reviews,Manmendar singh,good,Reviewed in India on 23 December 2019,good product,4.0 out of 5 stars,quality
1580574584-4134,https://www.amazon.in/Redmi-Note-Pro-Storage-Processor/product-reviews/B07X2KLKRZ/ref=cm_cr_dp_d_show_all_btm?ie=UTF8&reviewerType=all_reviews,arsh,Performance-based,Reviewed in India on 1 December 2019,"Super camera and performance
But battery is quite good .
Very smooth gameplay",5.0 out of 5 stars,quality
1580574291-3106,https://www.amazon.in/Redmi-Note-Pro-Storage-Processor/product-reviews/B07X2KLKRZ/ref=cm_cr_dp_d_show_all_btm?ie=UTF8&reviewerType=all_reviews,PRATIM BOSE,Good one in reasonable price,Reviewed in India on 30 January 2020,Good phone with reasonable Price. Performance is very good. Camera also very good,5.0 out of 5 stars,quality
1580574760-4724,https://www.amazon.in/Redmi-Note-Pro-Storage-Processor/product-reviews/B07X2KLKRZ/ref=cm_cr_dp_d_show_all_btm?ie=UTF8&reviewerType=all_reviews,Bhide,Amazing,Reviewed in India on 19 November 2019,"Best phone at this price
Fast processer
Best design
#mi
????",5.0 out of 5 stars,quality
1580573384-1,https://www.amazon.in/Redmi-Note-Pro-Storage-Processor/product-reviews/B07X2KLKRZ/ref=cm_cr_dp_d_show_all_btm?ie=UTF8&reviewerType=all_reviews,sanower ali warsi,friensds Read my review before by ones..,Reviewed in India on 10 November 2019,"after using 17 days ..I would like to say ..if you are thinking To by this phone for processors then go for it...I am giving 3-star just for running smoothly. But if you thinking to by for Quad camera then its Bad decision like me...( No detailing in long distance subject in Image. If you go for more than 4x zoom image quality Die. Slow motion video not support to take long time. As well micron lenses not professional ..)
presently I am not happy with camera.. Hope for Future update...",3.0 out of 5 stars,quality
1580573826-1488,https://www.amazon.in/Redmi-Note-Pro-Storage-Processor/product-reviews/B07X2KLKRZ/ref=cm_cr_dp_d_show_all_btm?ie=UTF8&reviewerType=all_reviews,Yash m.,Game changer... All rounder.,Reviewed in India on 18 November 2019,"This is the best mobile phone for all types of person...
Positive points:
Top camera.
Top design
Top protection.
Back glass panel
Killer processor.
So more...
Negative:
I can't find for mine...",5.0 out of 5 stars,quality
